正反同义标签,格式标签,否定式,肯定式
0,不要太a,文荃心没好气地回到：“做人不要太过分，我是在帮你的忙。,文荃心没好气地回到：“做人太过分，我是在帮你的忙。
0,几乎没,」志人君头也不回地说:「从传动轴到包厢都被他分解了，几乎没使用任何工具就拆毁了。,」志人君头也不回地说:「从传动轴到包厢都被他分解了，几乎使用任何工具就拆毁了。
0,好不a,表面已出发的皇阴公，其实一直不曾离开过“皇京城”，他看不见小白被杀死，心底就是好不安宁。果然，三皇爷二百“皇卫军”，也杀不了原已重创的小白！,表面已出发的皇阴公，其实一直不曾离开过“皇京城”，他看不见小白被杀死，心底就是好安宁。果然，三皇爷二百“皇卫军”，也杀不了原已重创的小白！
1,差点没,当含有独特刺激性的双氧水触碰到她伤口时，她差点没痛的跳起来。,当含有独特刺激性的双氧水触碰到她伤口时，她差点痛的跳起来。
0,几乎没,运气真差，她几乎没弄出声音，竟然还是吵醒了恶魔……这下子，完蛋了。,运气真差，她几乎弄出声音，竟然还是吵醒了恶魔……这下子，完蛋了。
0,难免不,这样就避免了一人挡道，万夫莫进的弊病，必然加快了编写、出版的速度。当然，快就容易出纰漏，是局外人就难免不知情，何况又涉及到这么多门类、这么多人物，因之鲁鱼亥豕，错误不当之处是不能为编者曲讳的。,这样就避免了一人挡道，万夫莫进的弊病，必然加快了编写、出版的速度。当然，快就容易出纰漏，是局外人就难免知情，何况又涉及到这么多门类、这么多人物，因之鲁鱼亥豕，错误不当之处是不能为编者曲讳的。
1,差点没,”海澄低下头鼓了鼓腮，想起那皮包骨的竹竿儿，他差点没有吐出来。,”海澄低下头鼓了鼓腮，想起那皮包骨的竹竿儿，他差点吐出来。
1,小心别,在我好不容易找到你的爱之后，却又要如此无情地分隔你我……“把车里的安全带剪断，小心别伤到她了。,在我好不容易找到你的爱之后，却又要如此无情地分隔你我……“把车里的安全带剪断，小心伤到她了。
0,几乎没,谁知两臂相交，几乎没能抬起，醉汉只是很自然的向左抢出两步身子幌了两幌，但是他通胸前，由于稍微疏忽大意，被对方在衣衫上撕了约有寸许长的一道裂缝！,谁知两臂相交，几乎能抬起，醉汉只是很自然的向左抢出两步身子幌了两幌，但是他通胸前，由于稍微疏忽大意，被对方在衣衫上撕了约有寸许长的一道裂缝！
1,好不a,”骄阳的醋热，驱不走斗场上笼罩着的森森煞气，龙栖坪上，气氛在无比的紧张中，带着无比的肃杀，而人们的心也在狂跳着，热血在澎湃着，环境，融合着人们心里的感触，好不壮观，好不惨烈。,”骄阳的醋热，驱不走斗场上笼罩着的森森煞气，龙栖坪上，气氛在无比的紧张中，带着无比的肃杀，而人们的心也在狂跳着，热血在澎湃着，环境，融合着人们心里的感触，好壮观，好不惨烈。
0,几乎没,这么多年，他双休日几乎没休过，长年超负荷地工作。,这么多年，他双休日几乎休过，长年超负荷地工作。
1,好不a,牵挂了多年的事终于在此刻有了结果，他总算能放下心中的负担了，一张面容又哭又笑地好不滑稽他大哥的血脉保全了，他今世也没有遗憾了。,牵挂了多年的事终于在此刻有了结果，他总算能放下心中的负担了，一张面容又哭又笑地好滑稽他大哥的血脉保全了，他今世也没有遗憾了。
0,几乎没,彭伟民不像其他中关村的“大亨”们那么难找，几乎没费什么劲儿，便在西三环北路花园街６８号那幢乳白色小楼里“逮”住了...,彭伟民不像其他中关村的“大亨”们那么难找，几乎费什么劲儿，便在西三环北路花园街６８号那幢乳白色小楼里“逮”住了...
0,不要太a,步少堤张大嘴想告诉他们事情的始末，但想了想后，还是觉得不要太多嘴的好，免得泄露大多后会被修理，不过他们这样躲、那样逃的样子，看了实在是很令人同情。,步少堤张大嘴想告诉他们事情的始末，但想了想后，还是觉得太多嘴的好，免得泄露大多后会被修理，不过他们这样躲、那样逃的样子，看了实在是很令人同情。
1,好不a,无意中闯入了无忧团购的论坛，发现这小小的“二手市场”也是人来人往，好不热闹。虽然“无忧”二手市场的保障体系不安全，但上面的网友大部分是很诚信的买家。,无意中闯入了无忧团购的论坛，发现这小小的“二手市场”也是人来人往，好热闹。虽然“无忧”二手市场的保障体系不安全，但上面的网友大部分是很诚信的买家。
1,差点没,”姜飞方答：“可笑方才崖上所遇五人从后跟踪，差一点没有发生误会。,”姜飞方答：“可笑方才崖上所遇五人从后跟踪，差一点发生误会。
1,差点没,隔天我就顶着两个大黑轮去学校上课，梅芬差点没吐血，直问我昨晚做了什么不可见人的勾当。,隔天我就顶着两个大黑轮去学校上课，梅芬差点吐血，直问我昨晚做了什么不可见人的勾当。
1,好不a,”国香微笑，“你们一家人好不活泼。”大哥的声音：“你肯定是他？,”国香微笑，“你们一家人好活泼。”大哥的声音：“你肯定是他？
1,好不a,虽然仍是大白天，太阳暖暖地照着大地，凌云飞却觉得四周阴森森的，好不可怕，心中想道：“那蛇王也不知吃了多少人了，这方的人都怕成这个样，没有一个人敢进这一带。,虽然仍是大白天，太阳暖暖地照着大地，凌云飞却觉得四周阴森森的，好可怕，心中想道：“那蛇王也不知吃了多少人了，这方的人都怕成这个样，没有一个人敢进这一带。
0,不要太a,　“你不要太难过，他是因为病，心里不痛快……”,　“你太难过，他是因为病，心里不痛快……”
0,不要太a,男女职员若不穿公司制服，那么只要简单清洁即可，式样不要太老旧。,男女职员若不穿公司制服，那么只要简单清洁即可，式样太老旧。
1,好不a,这日――――＂水阁＂内充满银铃般的清脆笑语，好不热闹。“大姊，我们来了这么久，你还没告诉我们究竟有什么大事！,这日――――＂水阁＂内充满银铃般的清脆笑语，好热闹。“大姊，我们来了这么久，你还没告诉我们究竟有什么大事！
1,好不a,”她瞠目结舌，好不惊讶。就连她自己也仅在一张模糊照片中看过母亲的长相。,”她瞠目结舌，好惊讶。就连她自己也仅在一张模糊照片中看过母亲的长相。
0,几乎没,他们以征服者身份进行统治，对中国的制度或者中国人的生活方式几乎没作什么让步。,他们以征服者身份进行统治，对中国的制度或者中国人的生活方式几乎作什么让步。
1,好不a,〈畸情小剧场〉编剧：奸子是也本日公演剧名：断袖问情（变调篇）某日清晨，在王公公还未来请皇上起床时，皇上刘欣便先行醒来，转身想起床时，赫然发现自己的袖子被身旁熟睡的爱卿董贤两手抓住，并咬住不放，衣角上还沾满了“天衣神水”，看来好不恶心。刘欣不禁暗叫：“天啊！,〈畸情小剧场〉编剧：奸子是也本日公演剧名：断袖问情（变调篇）某日清晨，在王公公还未来请皇上起床时，皇上刘欣便先行醒来，转身想起床时，赫然发现自己的袖子被身旁熟睡的爱卿董贤两手抓住，并咬住不放，衣角上还沾满了“天衣神水”，看来好恶心。刘欣不禁暗叫：“天啊！
0,几乎没,哇，你制造的混乱还真棒！我几乎没看过这么大的奶水坑。,哇，你制造的混乱还真棒！我几乎看过这么大的奶水坑。
1,好不a,谈话间，刘增耀从左边衣兜里掏出“药葫芦”，倒出５粒速效救心丸，塞进嘴里，动作好不娴熟。我晓得，在他右边衣袋里还装着消心痛和山海丹，这是工人告诉我的。,谈话间，刘增耀从左边衣兜里掏出“药葫芦”，倒出５粒速效救心丸，塞进嘴里，动作好娴熟。我晓得，在他右边衣袋里还装着消心痛和山海丹，这是工人告诉我的。
1,好不a,大家你一言我一语的，好不热闹。“我不答应。,大家你一言我一语的，好热闹。“我不答应。
0,几乎没,“陪考官”们几乎没发问，只有那位“主考官”翻着我的简历表问了我几句话：“结婚了吗？,“陪考官”们几乎发问，只有那位“主考官”翻着我的简历表问了我几句话：“结婚了吗？
1,好不a,两姊妹笑得好不天真，“请问你是苏姊姊吗？,两姊妹笑得好天真，“请问你是苏姊姊吗？
1,好不a,四海讲得好不兴奋，忽闻鸡啼。,四海讲得好兴奋，忽闻鸡啼。
0,不要太a,如果不想变成黄脸婆，我劝大家，生活中的很多问题都要顺其自然，不要太强求，说白了就是仨字“想开点”。,如果不想变成黄脸婆，我劝大家，生活中的很多问题都要顺其自然，太强求，说白了就是仨字“想开点”。
1,好不a,“温婉的性情、甜美的笑容，她蕙质兰心得可说是人间极品，完美到叫人捶胸顿足，但是――一哭长城动，二哭山河裂，三哭惊天地，她的哭功无人能及，随时随地像个受尽委屈的小媳妇儿，只要一点点小触霉，她都有本事哭得让人以为一家老小死光光，好不悲惨。而她是三人之中，气质最“大家闺秀”、最“正常”的女人。,“温婉的性情、甜美的笑容，她蕙质兰心得可说是人间极品，完美到叫人捶胸顿足，但是――一哭长城动，二哭山河裂，三哭惊天地，她的哭功无人能及，随时随地像个受尽委屈的小媳妇儿，只要一点点小触霉，她都有本事哭得让人以为一家老小死光光，好悲惨。而她是三人之中，气质最“大家闺秀”、最“正常”的女人。
1,好不a,每逢节假日，家里都会开一次“家庭音乐会”，好不温馨。尤其是王宝枝，还花钱买二胡送给村里的老人，每周两个晚上，叫上村里的老人在自家花园唱芗剧。,每逢节假日，家里都会开一次“家庭音乐会”，好温馨。尤其是王宝枝，还花钱买二胡送给村里的老人，每周两个晚上，叫上村里的老人在自家花园唱芗剧。
0,几乎没,在情节的发展上，大副几乎没起任何作用，但他与船长的怀疑精神形成了对比,在情节的发展上，大副几乎起任何作用，但他与船长的怀疑精神形成了对比
1,差点没,小姨一听那话，眼睛立刻红了，差点没落下泪珠子来。,小姨一听那话，眼睛立刻红了，差点落下泪珠子来。
0,几乎没,往年每到暑假，“求租床位”的小广告早贴到各高校的宿舍区，但今年这样的小广告却几乎没出现过，因为非典过后不少高校明令学生禁止把床位出租。,往年每到暑假，“求租床位”的小广告早贴到各高校的宿舍区，但今年这样的小广告却几乎出现过，因为非典过后不少高校明令学生禁止把床位出租。
1,几乎没,”编剧赶到来，才听了任澄几句话，几乎没想上吊！,”编剧赶到来，才听了任澄几句话，几乎想上吊！
1,好不a,夜叉族──平静的村落里有几个小孩子正在玩耍，那笑声清清脆脆好不悦耳；但声音不知道为什么突然停了，村里的人人们还没来得及探出头来，孩子们已经惊叫起来！,夜叉族──平静的村落里有几个小孩子正在玩耍，那笑声清清脆脆好悦耳；但声音不知道为什么突然停了，村里的人人们还没来得及探出头来，孩子们已经惊叫起来！
1,好不a,适意忍痛地朝他摇摇首，好不痛心地逼自己不要被他所影响，努力的抵抗着那盘鲜嫩欲滴的美味烧肉所带给她的强大吸引力。,适意忍痛地朝他摇摇首，好痛心地逼自己不要被他所影响，努力的抵抗着那盘鲜嫩欲滴的美味烧肉所带给她的强大吸引力。
1,差点没,这件事在她心里所引起的，只是一种怜悯之情；这个顽皮的孩子只是为了讨她的欢心才想到上菜园子里去偷东西，而因为这个他差一点没把船误了。,这件事在她心里所引起的，只是一种怜悯之情；这个顽皮的孩子只是为了讨她的欢心才想到上菜园子里去偷东西，而因为这个他差一点把船误了。
0,难免不,有时我们认为可以了，他认为不行，则来一句陕西话：『别往过混！』他边记录边想点子，难免不理想,有时我们认为可以了，他认为不行，则来一句陕西话：『别往过混！』他边记录边想点子，难免理想
0,几乎没,学校规定上午7点半上班，下午4点半下班，可她几乎没能准时下班过。,学校规定上午7点半上班，下午4点半下班，可她几乎能准时下班过。
0,不要太a,虽然我觉得在大庭广众之下做出如此事情有失大雅，但我也会憋足全身气力回敬他一次，以此来证明我的存在，告诫隔壁不要太放肆，做人还是收敛一些的好，可我每次都是力不从心，无法做到惟妙惟肖，隔壁依旧在气焰嚣张地做着坏事，看着别人在我的面前兴风作浪、胡作非为而自己却束手无措，这就是人体功能造就的巨大悲哀，人比人气死人呀一个人在完成他的大便工作后，会收拾一下残局，用水将它们冲掉，它们被水冲走后也有两种不同的声音，一种是“扑嗵”的声音，仿佛一块巨石投入水中，这种声音的主人往往体魄健壮、身材魁,虽然我觉得在大庭广众之下做出如此事情有失大雅，但我也会憋足全身气力回敬他一次，以此来证明我的存在，告诫隔壁太放肆，做人还是收敛一些的好，可我每次都是力不从心，无法做到惟妙惟肖，隔壁依旧在气焰嚣张地做着坏事，看着别人在我的面前兴风作浪、胡作非为而自己却束手无措，这就是人体功能造就的巨大悲哀，人比人气死人呀一个人在完成他的大便工作后，会收拾一下残局，用水将它们冲掉，它们被水冲走后也有两种不同的声音，一种是“扑嗵”的声音，仿佛一块巨石投入水中，这种声音的主人往往体魄健壮、身材魁
1,就差没,」就差没追问一句：这跟「时局」何关？,」就差追问一句：这跟「时局」何关？
0,几乎没,”他说已经吃好了，我使劲摇头说，你几乎没吃东西嘛，哪能就吃好了？,”他说已经吃好了，我使劲摇头说，你几乎吃东西嘛，哪能就吃好了？
1,好不a,如今只要委托“猎头”，精兵强将任挑选，好不舒服！,如今只要委托“猎头”，精兵强将任挑选，好舒服！
1,差点没,她小嘴撇了一下，半责半嗔地勾了我一眼。这一眼，差点没让我喊：“魂兮归来!”,她小嘴撇了一下，半责半嗔地勾了我一眼。这一眼，差点让我喊：“魂兮归来!”
1,差点没,……”佟老师跳着脚，榨着那副女人似的嗓子叫着――嘴里那两颗金牙差点儿没掉下来。,……”佟老师跳着脚，榨着那副女人似的嗓子叫着――嘴里那两颗金牙差点儿掉下来。
0,几乎没,不像那几日，她孤身守在灵堂，他几乎没敢让她离开过自己视线，直到她住回坤宁宫。,不像那几日，她孤身守在灵堂，他几乎敢让她离开过自己视线，直到她住回坤宁宫。
0,不要太a,”“她有她的生长背景和苦难，你不要太严。”“我们犹太人难道不苦吗？,”“她有她的生长背景和苦难，你太严。”“我们犹太人难道不苦吗？
1,差点没,”元健差点没晕过去。,”元健差点晕过去。
0,不要太a,近年来由于燃气助动车增加较快，这方面的矛盾就比较突出了，燃气助动车的特点一是每次加气数量少，只有几元钱的生意，二是加气的频率高，车主一般都希望站点之间距离分布合理、不要太远。面对这些新的情况，有关部门正在考虑妥善的解决方案。,近年来由于燃气助动车增加较快，这方面的矛盾就比较突出了，燃气助动车的特点一是每次加气数量少，只有几元钱的生意，二是加气的频率高，车主一般都希望站点之间距离分布合理、太远。面对这些新的情况，有关部门正在考虑妥善的解决方案。
0,几乎没,萨拉几乎没听说过这事；她的思绪在另一条轨道上飞速奔驰着。,萨拉几乎听说过这事；她的思绪在另一条轨道上飞速奔驰着。
0,不要太a,龙飞正想询问细节，却被冰承祖的言语打断：“杰洛斯公子，您大病初愈，还是不要太劳累的比较好，先休息几天，过两天老朽在来和您祥谈。,龙飞正想询问细节，却被冰承祖的言语打断：“杰洛斯公子，您大病初愈，还是太劳累的比较好，先休息几天，过两天老朽在来和您祥谈。
0,不要太a,”金大帅道：“那好吧，你下手时不要太快了，也不要玩花活，头一刀可不要切在她脊背上。,”金大帅道：“那好吧，你下手时太快了，也不要玩花活，头一刀可不要切在她脊背上。
1,差点没,”她特别强调“小弟弟”三个字的发音，得意地差点没仰天长啸一番。,”她特别强调“小弟弟”三个字的发音，得意地差点仰天长啸一番。
0,不要太a,志华终于听出志国是在寻他开心，不由摇摇头，“不要太过分。”“Ｓｏｒｒｙ。,志华终于听出志国是在寻他开心，不由摇摇头，“太过分。”“Ｓｏｒｒｙ。
0,几乎没,阿荣坐在一旁一声不响地吃着饭，母亲和市子谈话时她几乎没说一句话。望着乖觉听话的阿荣，市子觉得她似乎变成了小孩子。,阿荣坐在一旁一声不响地吃着饭，母亲和市子谈话时她几乎说一句话。望着乖觉听话的阿荣，市子觉得她似乎变成了小孩子。
0,不要太a,纪叔是你的长辈，你不要太嚣张！”“我嚣张？,纪叔是你的长辈，你太嚣张！”“我嚣张？
0,不要太a,我劝你不要太积极，处处大公无私，结果是老婆也娶不上。,我劝你太积极，处处大公无私，结果是老婆也娶不上。
1,差点没,“凯撒”被这忽然的动作所激怒，差点没将他掀下来。,“凯撒”被这忽然的动作所激怒，差点将他掀下来。
1,看我不,看我不揍你！,看我揍你！
0,几乎没,”无钦轻叹了一口气，嘴角露出苦笑，心中却十分感慨，他小时命运悲惨，长大复仇之后又破人追杀，几乎没遇过一天好日子，闯出的尽是恶名，直到今日才算是有些扬眉吐气，他忍着心中激动，表面平静的对无乘大师道：“这是无钦份所当为……只要取一些木材焚烧，一个时辰后毒性尽去，可以重新比武。,”无钦轻叹了一口气，嘴角露出苦笑，心中却十分感慨，他小时命运悲惨，长大复仇之后又破人追杀，几乎遇过一天好日子，闯出的尽是恶名，直到今日才算是有些扬眉吐气，他忍着心中激动，表面平静的对无乘大师道：“这是无钦份所当为……只要取一些木材焚烧，一个时辰后毒性尽去，可以重新比武。
1,好不a,最近，关于客车价格的事情沸沸扬扬，好不热闹。但不论从什么角度看，承认也好，不认账也好，价格却是实实在在地打了起来。,最近，关于客车价格的事情沸沸扬扬，好热闹。但不论从什么角度看，承认也好，不认账也好，价格却是实实在在地打了起来。
1,好不a,因此，当我们名正言顺住进这占地面积20平方米的老式套房时，一家3代5口人乐得合不拢嘴，整天你进我出，欢声笑语，日子过得好不红火，好不舒心。但儿子和我总还觉得有点美中不足。,因此，当我们名正言顺住进这占地面积20平方米的老式套房时，一家3代5口人乐得合不拢嘴，整天你进我出，欢声笑语，日子过得好不红火，好舒心。但儿子和我总还觉得有点美中不足。
1,差点没,”铁狠风听到她的回答，头顶气得差点没冒烟。,”铁狠风听到她的回答，头顶气得差点冒烟。
0,不要太a,“还、还是不要太残忍的好。,“还、还是太残忍的好。
1,好不a,多次出差到福州，见火车站广场附近摊点上的水果很是鲜嫩，好不诱人；又听说“宰”客挺厉害的，只好作罢。,多次出差到福州，见火车站广场附近摊点上的水果很是鲜嫩，好诱人；又听说“宰”客挺厉害的，只好作罢。
1,就差没,”她来来回回地踱步、怒吼，就差没抡起金箍棒轰他出门。,”她来来回回地踱步、怒吼，就差抡起金箍棒轰他出门。
0,不要太a,用淘米水洗脸，头遍淘米水不要，留下清洁的二遍淘米水，加入一点温水，温度不要太高，淘米水里有维生素和淀粉；也可以在家里养一盆芦荟，每天切一点下来，榨出汁，把汁加入水中洗脸，或者直接把汁涂在痘痘上，芦荟有修复的作用；还有一招就是用牙膏，早晚涂一点点在痘痘上面，然后洗掉，牙膏可以刘女士之多拍脸法我读高中、大学时也长了很多青春痘，那个时候都不敢抬头见人，天天偷偷地照镜子，那个时候自尊心强，又特别爱美，外用内服的药吃了一大堆，钱花了不少，痘痘却是停,用淘米水洗脸，头遍淘米水不要，留下清洁的二遍淘米水，加入一点温水，温度太高，淘米水里有维生素和淀粉；也可以在家里养一盆芦荟，每天切一点下来，榨出汁，把汁加入水中洗脸，或者直接把汁涂在痘痘上，芦荟有修复的作用；还有一招就是用牙膏，早晚涂一点点在痘痘上面，然后洗掉，牙膏可以刘女士之多拍脸法我读高中、大学时也长了很多青春痘，那个时候都不敢抬头见人，天天偷偷地照镜子，那个时候自尊心强，又特别爱美，外用内服的药吃了一大堆，钱花了不少，痘痘却是停
1,差点没,种种手续办完，马老先生差点没晕过去；心里说，早知道这么麻烦，要命也不上外国来！,种种手续办完，马老先生差点晕过去；心里说，早知道这么麻烦，要命也不上外国来！
1,差点没,”政成差点没让鱼骨头噎着，“战死？,”政成差点让鱼骨头噎着，“战死？
1,好不a,我躺下时好不悲伤！我一次又一次想我在斯宾罗先生眼中的寒伧；想我不再会有向朵拉求婚时的自信；想我应当把我的经济状况从实告诉朵拉，如果她认为合适就可以解除这婚约；想我在长长的见习期间，无半分进项，如何度日；想做点什么帮助姨奶奶，却又想不出该做什么；想我穷到身无分文，衣衫我知道，这样多为自己想却很少为姨奶奶想正是我可鄙之处；不过，迄今自私已与朵拉分不开了，我不能因为任何人而把朵拉放在,我躺下时好悲伤！我一次又一次想我在斯宾罗先生眼中的寒伧；想我不再会有向朵拉求婚时的自信；想我应当把我的经济状况从实告诉朵拉，如果她认为合适就可以解除这婚约；想我在长长的见习期间，无半分进项，如何度日；想做点什么帮助姨奶奶，却又想不出该做什么；想我穷到身无分文，衣衫我知道，这样多为自己想却很少为姨奶奶想正是我可鄙之处；不过，迄今自私已与朵拉分不开了，我不能因为任何人而把朵拉放在
1,好不a,黛比看着她们一群好姊妹坐在壁炉前递着酒喝，又说又笑的好不开心。“我们轮流的教她几招对付男人的方法，我先开始。,黛比看着她们一群好姊妹坐在壁炉前递着酒喝，又说又笑的好开心。“我们轮流的教她几招对付男人的方法，我先开始。
1,差点没,不看犹可，一看到症结所在；一向冷颜旁罕笑的欧阳敏差点没笑岔了气。,不看犹可，一看到症结所在；一向冷颜旁罕笑的欧阳敏差点笑岔了气。
0,不要太a,他的体力已经不支，但他还是对我说：对这首诗的解释要宽一些，不要太窄。,他的体力已经不支，但他还是对我说：对这首诗的解释要宽一些，太窄。
1,好不a,结实的肌肉与宽阔的胸膛上，挂着许多细碎的牙印、指印和瘀青，好不壮观！小莫烧红了脸，被他嘲龙的语气羞得不自在地低下头，瞟着仅用被单蔽体的胸膛，想起昨夜的疯狂，心头猛跳。,结实的肌肉与宽阔的胸膛上，挂着许多细碎的牙印、指印和瘀青，好壮观！小莫烧红了脸，被他嘲龙的语气羞得不自在地低下头，瞟着仅用被单蔽体的胸膛，想起昨夜的疯狂，心头猛跳。
1,差点没,济民这一气非同小可，差点没送了半条命。,济民这一气非同小可，差点送了半条命。
