正反同义标签,格式标签,否定式,肯定式
0,难免不,"在现场协助清点并鉴定武器种类的美军士兵,看到这些物件难免不寒而栗--它们中的任何一件都有可能使他们在伊拉克命丧黄泉。","在现场协助清点并鉴定武器种类的美军士兵,看到这些物件难免寒而栗--它们中的任何一件都有可能使他们在伊拉克命丧黄泉。"
1,小心别,下次再有人去苏州，一定要小心别上那些带路者的当，如果跟他们去买衣服，他们一定要向老板拿回扣，那肯定比自己直接向店家买要贵很多。,下次再有人去苏州，一定要小心上那些带路者的当，如果跟他们去买衣服，他们一定要向老板拿回扣，那肯定比自己直接向店家买要贵很多。
1,差点没,练了一个礼拜，她差点儿没累死。,练了一个礼拜，她差点儿累死。
1,难免不,也有人仍想挤到近处，难免不挨了锦衣卫和兵马司的皮鞭、棍棒，更严重的是加一个在皇后千秋节扰乱经场的罪名，用绳子捆了带走。,也有人仍想挤到近处，难免挨了锦衣卫和兵马司的皮鞭、棍棒，更严重的是加一个在皇后千秋节扰乱经场的罪名，用绳子捆了带走。
1,好不a,然而，这消息毕竟传到洛阳城了――早晨的阳光温柔地射进了木窗，其心施施然从床上坐了起来，他把窗子推得更开一些，窗外，一片光明晨景好不美丽。其心把被子踢开，轻轻跃下床来，他推开房门，门口已站了两个人。,然而，这消息毕竟传到洛阳城了――早晨的阳光温柔地射进了木窗，其心施施然从床上坐了起来，他把窗子推得更开一些，窗外，一片光明晨景好美丽。其心把被子踢开，轻轻跃下床来，他推开房门，门口已站了两个人。
0,差点没,一把抓住公爵夫人的手，仿佛她想溜掉，仿佛她想溜掉，他差点儿没有把她留住似的,一把抓住公爵夫人的手，仿佛她想溜掉，仿佛她想溜掉，他差点儿有把她留住似的
0,不要太a,（２）在妊娠中后期加强运动，营养浓度不要太高。（３）使用前列腺，使其比预产期提前１～２天产仔，最好控制在白天产仔，便于助产（一般在当日早晨注射１支，第二天上午开始产仔）。,（２）在妊娠中后期加强运动，营养浓度太高。（３）使用前列腺，使其比预产期提前１～２天产仔，最好控制在白天产仔，便于助产（一般在当日早晨注射１支，第二天上午开始产仔）。
1,好不a,※※※星期二机场内人来人往好不热闹，若不是费天翔在电话里再三的恳求，戴晴才不想来送这个害她和费云翔大吵一架的罪魁祸首，但，当她见着费天翔，却不免为他浑身的伤大惊，大惊失色的追问：“你怎么啦？,※※※星期二机场内人来人往好热闹，若不是费天翔在电话里再三的恳求，戴晴才不想来送这个害她和费云翔大吵一架的罪魁祸首，但，当她见着费天翔，却不免为他浑身的伤大惊，大惊失色的追问：“你怎么啦？
1,好不a,炎热的下午的阳光从两扇大窗户漾进来，她往椅背上一靠，伸出双脚，好不惬意！太阳离开了阳台，石墩上几个陶制花盆里可怜的植物耐不住炎热，蜷缩起干巴巴的叶子；阳台一角的木板上那口圆圆的锅里，一棵荷兰芹却倍受照料，生机勃勃；猫在一块席子上睡得正香，墩布挂在绳子上晒晾；外面，湛蓝“你胃口不错，若安娜太太，胃口不错！,炎热的下午的阳光从两扇大窗户漾进来，她往椅背上一靠，伸出双脚，好惬意！太阳离开了阳台，石墩上几个陶制花盆里可怜的植物耐不住炎热，蜷缩起干巴巴的叶子；阳台一角的木板上那口圆圆的锅里，一棵荷兰芹却倍受照料，生机勃勃；猫在一块席子上睡得正香，墩布挂在绳子上晒晾；外面，湛蓝“你胃口不错，若安娜太太，胃口不错！
1,难免不,尧说：“儿子多了，无力管教，将成为负累；财富多了，不善处理，必多事端；而活得太久，就难免不被人诟辱为老而不死。,尧说：“儿子多了，无力管教，将成为负累；财富多了，不善处理，必多事端；而活得太久，就难免被人诟辱为老而不死。
1,就差没,他的手已经举起来，[就差没]有打下去。,他的手已经举起来，[就差没]有打下去。
1,好不a,偏偏天冷山高，火势不易燃大，白粥较难煮开，急得她好不心焦。好不容易盼到粥热，赶忙取来，并将父亲扶起，靠在石壁，一口口喂食过去，仍自不断问着：“爹爹您觉得如何？,偏偏天冷山高，火势不易燃大，白粥较难煮开，急得她好心焦。好不容易盼到粥热，赶忙取来，并将父亲扶起，靠在石壁，一口口喂食过去，仍自不断问着：“爹爹您觉得如何？
1,差点没,”田蜜差点没跪下来求他们。,”田蜜差点跪下来求他们。
0,不要太a,“老太太也不要太高兴，不家肯不肯，还在未知之数。,“老太太也太高兴，不家肯不肯，还在未知之数。
0,几乎没,只剩一条腿的小兵王浦生几乎没穿衣服，只穿着各种绷带。,只剩一条腿的小兵王浦生几乎穿衣服，只穿着各种绷带。
1,好不a,啸声一进洞，一进了这矮矮小小，狭窄的洞穴，便变得更响了，那声音直钻入郭无雨的耳中，好不难受。郭无雨年纪还小，更没什么功力，如何能抵御黑衣人的啸声？,啸声一进洞，一进了这矮矮小小，狭窄的洞穴，便变得更响了，那声音直钻入郭无雨的耳中，好难受。郭无雨年纪还小，更没什么功力，如何能抵御黑衣人的啸声？
1,好不a,就在切尼访问唐宁街的那一天，７０名议员联合签署的一份“深表不安”的动议书送到了唐宁街１０号，令布莱尔好不尴尬。此外，美国副总统切尼访问中东１１国时遭到的冷遇，使“烫手山芋”变得更烫手了。,就在切尼访问唐宁街的那一天，７０名议员联合签署的一份“深表不安”的动议书送到了唐宁街１０号，令布莱尔好尴尬。此外，美国副总统切尼访问中东１１国时遭到的冷遇，使“烫手山芋”变得更烫手了。
1,就差没,我为那些花瓣鞠了一把泪，就差没学黛玉葬花了。,我为那些花瓣鞠了一把泪，就差学黛玉葬花了。
0,差点没,水若在睡梦中被他压得差点没了气，猛然惊醒过来，连连咳了几声才回过气。,水若在睡梦中被他压得差点了气，猛然惊醒过来，连连咳了几声才回过气。
1,难免不,新任财政大臣克拉克表示，只靠经济复苏不能解决赤字问题，而加税又难免不影响刚刚复苏的经济。,新任财政大臣克拉克表示，只靠经济复苏不能解决赤字问题，而加税又难免影响刚刚复苏的经济。
1,差点没,雷环山乍听到这个消息时，却像被人从背后猛击了一掌，差点没昏厥过去。,雷环山乍听到这个消息时，却像被人从背后猛击了一掌，差点昏厥过去。
0,几乎没,罗维民几乎没作任何停留，绕过处理现场的车辆和人群，向赶来现场的交警亮明身分，可能是由于前面做了工作的原因，公路上的车辆越来越稀少，于是罗维民的车也就越开越快。,罗维民几乎作任何停留，绕过处理现场的车辆和人群，向赶来现场的交警亮明身分，可能是由于前面做了工作的原因，公路上的车辆越来越稀少，于是罗维民的车也就越开越快。
0,几乎没,"从澳大利亚返回已经六年了,但移民的苦难和这六年时光几乎没在AA身上留下痕迹,她就像一株鲜活水灵的植物","从澳大利亚返回已经六年了,但移民的苦难和这六年时光几乎在AA身上留下痕迹,她就像一株鲜活水灵的植物"
1,好不a,中山公园门前，卖小兔子、小鸡、小鸭、小豚猪的小贩也像被一夜春风催生出来似的，好不热闹，吸引了众多小孩子和年轻人的流连。,中山公园门前，卖小兔子、小鸡、小鸭、小豚猪的小贩也像被一夜春风催生出来似的，好热闹，吸引了众多小孩子和年轻人的流连。
0,不要太a,“皓祯，你不要太难过，”吟霜咽着泪说：“说不定我是一只白狐，你就当我是只白狐吧！,“皓祯，你太难过，”吟霜咽着泪说：“说不定我是一只白狐，你就当我是只白狐吧！
1,好不a,”李存孝好不窘迫，道：“这个……我倒没听她说什么。,”李存孝好窘迫，道：“这个……我倒没听她说什么。
0,不要太a,为避免类似情况发生，对初次接受短化和药物服的病人，第一次发药不要太多，以１周蠢为，并对病人详细说明用药方法及注意事项。,为避免类似情况发生，对初次接受短化和药物服的病人，第一次发药太多，以１周蠢为，并对病人详细说明用药方法及注意事项。
0,几乎没,李推门进来的时候，我几乎没敢看坐在屋里的杨，李和杨在大学中那段尽人皆知的感情，让围坐叙旧的人们一下子失去了和尴尬抗衡的勇气。,李推门进来的时候，我几乎敢看坐在屋里的杨，李和杨在大学中那段尽人皆知的感情，让围坐叙旧的人们一下子失去了和尴尬抗衡的勇气。
0,差点没,”我差一点儿没抓住燕妮那只藏在皮大衣肥大衣袖中的手。,”我差一点儿抓住燕妮那只藏在皮大衣肥大衣袖中的手。
0,几乎没,老一代敦煌保护专家李云鹤说，从1944年敦煌艺术研究所成立到现在，莫高窟清沙工作几乎没停过。,老一代敦煌保护专家李云鹤说，从1944年敦煌艺术研究所成立到现在，莫高窟清沙工作几乎停过。
1,差点没,四肢突然颤抖，浑身打了一个寒噤，趔趄了一下，心里猛的一惊，差点儿没有摔倒。,四肢突然颤抖，浑身打了一个寒噤，趔趄了一下，心里猛的一惊，差点儿摔倒。
0,好不a,他这种深情的样子看得日烨好不自在。莫名的感动也在她的心中泛开来。,他这种深情的样子看得日烨好自在。莫名的感动也在她的心中泛开来。
0,几乎没,几乎没用多少市场推销攻势，亚运村以自身的知名度高、条件优越、服务功能齐...,几乎用多少市场推销攻势，亚运村以自身的知名度高、条件优越、服务功能齐...
1,小心别,特地从河南林县打来长途电话，嘱咐“老穆”要多穿衣服，小心别着凉……,特地从河南林县打来长途电话，嘱咐“老穆”要多穿衣服，小心着凉……
1,差点没,”不知是夸或贬，他笑到差点没呛到，还是一字不漏地说得很清楚。,”不知是夸或贬，他笑到差点呛到，还是一字不漏地说得很清楚。
1,就差没,”小林急得就差没跳起来。,”小林急得就差跳起来。
0,不要太a,当您收下了人家一点点轻微的礼品，叫我用许多贵重的东西酬答他们的时候，我总是摇头流泪，甚至于不顾自己卑贱的身分，再三劝告您不要太慷慨了。,当您收下了人家一点点轻微的礼品，叫我用许多贵重的东西酬答他们的时候，我总是摇头流泪，甚至于不顾自己卑贱的身分，再三劝告您太慷慨了。
1,好不a,韩江也暗暗觉得有些古怪，看殊儿在厅里游来荡去好不焦急，便道：“那我们同去魏先生的书房看看就是。,韩江也暗暗觉得有些古怪，看殊儿在厅里游来荡去好焦急，便道：“那我们同去魏先生的书房看看就是。
0,几乎没,很瘦，面色潮红，眼睛发亮，身上几乎没穿什么，一条紧绷绷的三角裤衩形迹可疑地鼓着。,很瘦，面色潮红，眼睛发亮，身上几乎穿什么，一条紧绷绷的三角裤衩形迹可疑地鼓着。
0,几乎没,她被强逼去学校学习她漏掉的许多课程，因为之前几乎没上过几堂课，她根本大字不认得几个，她那特殊敏锐的能力更加的令她感受到他人的情绪，学习所带来的障碍、同学的舢笑及恶意的作弄、老师自以为是的责骂每每令她一下课就躲在厕所哭泣。,她被强逼去学校学习她漏掉的许多课程，因为之前几乎上过几堂课，她根本大字不认得几个，她那特殊敏锐的能力更加的令她感受到他人的情绪，学习所带来的障碍、同学的舢笑及恶意的作弄、老师自以为是的责骂每每令她一下课就躲在厕所哭泣。
1,好不a,人，只是由于习俗的原因勉强为之，为的是给自己保留结婚的可能性，可他们很少想象男欢女爱所能带来的乐趣，因而容不得他们心爱的男人去品尝此种乐趣；后一原因是在他们与女人的关系中，他们为爱女色的女人扮演了另一个女人的角色，而与此同时，女人也差不多给他们提供了他们从男人身上获得的乐趣，以致妒火中烧的男友，一想到他情之所钟的男子竟与在他看来活脱脱是个男人的女人结合，心中好不痛苦，他同时感到心爱的男友就要摆脱他，因为对那些女人来说，这男子有点味儿，有点儿女人的我们暂且也不提那些疯狂少年，他们孩子气十足，故意戏弄朋友，冒犯父母，几近疯狂地热衷于选择裙袍之类的服装，抹口红，画眉黛；这些人姑且不提，因为末了遇到的往往是这种人，他们无论有多冷酷，却再也难以忍受自我作践带来的痛苦，于是便会一辈子规规矩矩，俨然似新教徒，试图纠正过去一时中邪铸成的过,人，只是由于习俗的原因勉强为之，为的是给自己保留结婚的可能性，可他们很少想象男欢女爱所能带来的乐趣，因而容不得他们心爱的男人去品尝此种乐趣；后一原因是在他们与女人的关系中，他们为爱女色的女人扮演了另一个女人的角色，而与此同时，女人也差不多给他们提供了他们从男人身上获得的乐趣，以致妒火中烧的男友，一想到他情之所钟的男子竟与在他看来活脱脱是个男人的女人结合，心中好痛苦，他同时感到心爱的男友就要摆脱他，因为对那些女人来说，这男子有点味儿，有点儿女人的我们暂且也不提那些疯狂少年，他们孩子气十足，故意戏弄朋友，冒犯父母，几近疯狂地热衷于选择裙袍之类的服装，抹口红，画眉黛；这些人姑且不提，因为末了遇到的往往是这种人，他们无论有多冷酷，却再也难以忍受自我作践带来的痛苦，于是便会一辈子规规矩矩，俨然似新教徒，试图纠正过去一时中邪铸成的过
0,不要太a,３防盗选择优良蜜源场地，间距离不要太近；根据季节、气候、地形，灵活摆放排列蜂群，预防盗和迷巢。,３防盗选择优良蜜源场地，间距离太近；根据季节、气候、地形，灵活摆放排列蜂群，预防盗和迷巢。
1,好不a,小姑娘哇哇地哭叫起来，那女人骂道：“揍死你这小杂种，你再哭！成天活也不干，白吃白喝，咱们小门小户，翻土拉块的人家，能养活起你吗？见天吃得饱饱的，喝得足足的，去串门子，倒好不自在！”,小姑娘哇哇地哭叫起来，那女人骂道：“揍死你这小杂种，你再哭！成天活也不干，白吃白喝，咱们小门小户，翻土拉块的人家，能养活起你吗？见天吃得饱饱的，喝得足足的，去串门子，倒好自在！”
0,好不a,＂雨梅顿觉这对沙慕凡来说，好不公平呀！,＂雨梅顿觉这对沙慕凡来说，好公平呀！
1,好不a,来的是一小队衙差，约十二三人，由一统带领队，大摇大摆，好不威风。他们选了一户人家。,来的是一小队衙差，约十二三人，由一统带领队，大摇大摆，好威风。他们选了一户人家。
0,不要太a,小叶，放心大胆地找，眼光不要太高。谁敢说三道四，我来批他！,小叶，放心大胆地找，眼光太高。谁敢说三道四，我来批他！
0,不要太a,你眼光不要太高，要不然就会像陈先生他儿子一样讨不到老婆哟。,你眼光太高，要不然就会像陈先生他儿子一样讨不到老婆哟。
1,差点没,三妖徒本来一肚子的恶气无从发泄，行经崖口前面，正在互相谈论，不料一条大柏木船由左侧断崖缺口内冲波乱流横断过来，差一点没有撞上。,三妖徒本来一肚子的恶气无从发泄，行经崖口前面，正在互相谈论，不料一条大柏木船由左侧断崖缺口内冲波乱流横断过来，差一点撞上。
1,好不a,‘寒泉冰’一个翻身，天马掠空，已飞过他头顶，挡在前头，目中凶光闪闪，宛如藏着什么妖魔鬼怪，好不吓人：“干什么？,‘寒泉冰’一个翻身，天马掠空，已飞过他头顶，挡在前头，目中凶光闪闪，宛如藏着什么妖魔鬼怪，好吓人：“干什么？
1,差点没,”高人凤摸摸头道：“我是糊涂了，所以才没有想到这一层，不过到后来，你把紫凤钗还给师妹，我才想到是她，当然还有一部分的推究和茜妹是相同的……”刘翩翩讪然笑道：“你跟谢姊姊同必同德，想法自然是一致的，只苦了我，刚才差点没拉出剑来抹了脖子！,”高人凤摸摸头道：“我是糊涂了，所以才没有想到这一层，不过到后来，你把紫凤钗还给师妹，我才想到是她，当然还有一部分的推究和茜妹是相同的……”刘翩翩讪然笑道：“你跟谢姊姊同必同德，想法自然是一致的，只苦了我，刚才差点拉出剑来抹了脖子！
0,几乎没,火灾扑灭后，记者多次进入严密封锁的火灾现场，眼前见到的只是黑漆漆的废墟，几乎没留下什么完整的物件。,火灾扑灭后，记者多次进入严密封锁的火灾现场，眼前见到的只是黑漆漆的废墟，几乎留下什么完整的物件。
0,不要太a,”刘备与关羽正走间，忽碰到单福之妹冬梅，玄德忙关切的道：“冬梅，你不要太悲伤了。,”刘备与关羽正走间，忽碰到单福之妹冬梅，玄德忙关切的道：“冬梅，你太悲伤了。
