正反同义标签,格式标签,否定式,肯定式
0,差点没,白奕云看着他们的游泳教学，觉得和当初阎曜季教他游泳时真是有天壤之别，当时他和曜季才十几岁，曜季有一身好泳技，而他完全不会，曜季好心提议教他游泳，但那一天是他的恶梦，因为曜季完全是斯巴达教育，放他溺水自救，差点没命，但也真有效的让他一天内学会游泳。,白奕云看着他们的游泳教学，觉得和当初阎曜季教他游泳时真是有天壤之别，当时他和曜季才十几岁，曜季有一身好泳技，而他完全不会，曜季好心提议教他游泳，但那一天是他的恶梦，因为曜季完全是斯巴达教育，放他溺水自救，差点命，但也真有效的让他一天内学会游泳。
1,好不a,好几次云晁岳气急，硬是想霸王硬上弓跨上追日，下场总是摔个狗吃屎，好不狼狈。碰过几回钉子，云晁岳终于决定还是他的爱驹迎风可爱，至少迎风怎么也不可能将他摔下。,好几次云晁岳气急，硬是想霸王硬上弓跨上追日，下场总是摔个狗吃屎，好狼狈。碰过几回钉子，云晁岳终于决定还是他的爱驹迎风可爱，至少迎风怎么也不可能将他摔下。
1,难免不,看守所不是生活在真空里，难免不受社会的影响。,看守所不是生活在真空里，难免受社会的影响。
1,好不a,人家在其他姐妹还在热火朝天大干桑拿的时候，便用美色和心计缠上了一个有钱有势的大老板，借助他的钱势做起了自己的生意，越做越大，终于自己也成了名副其实的大老板，有房子有车，好不威风。周慧慧尚未寻觅到理想的靠山，却被蒲德威盯上了。,人家在其他姐妹还在热火朝天大干桑拿的时候，便用美色和心计缠上了一个有钱有势的大老板，借助他的钱势做起了自己的生意，越做越大，终于自己也成了名副其实的大老板，有房子有车，好威风。周慧慧尚未寻觅到理想的靠山，却被蒲德威盯上了。
1,好不a,“呵呵……”轻松的笑语好不快意地又飘了下来。,“呵呵……”轻松的笑语好快意地又飘了下来。
1,好不a,”凝若笑用力地拍拍她的肩，笑得好不灿烂。四姨娘马上加入她的计划，“那就快去尽你身为朋友的道义！,”凝若笑用力地拍拍她的肩，笑得好灿烂。四姨娘马上加入她的计划，“那就快去尽你身为朋友的道义！
1,差点没,试问马伯乐的心情到底为什么愉快呢？鼻子摔破了，差一点没有摔死，摔得昏迷不省，人事不知，到现在那鼻子还在肿着。,试问马伯乐的心情到底为什么愉快呢？鼻子摔破了，差一点摔死，摔得昏迷不省，人事不知，到现在那鼻子还在肿着。
0,不要太a,准备两本厚度相当的书（也不要太厚哦），双手各拿一本。,准备两本厚度相当的书（也太厚哦），双手各拿一本。
1,差点没,”上校差点没给他的话气死，这算哪门子安慰的话！,”上校差点给他的话气死，这算哪门子安慰的话！
1,好不a,这一扯让黄镇东好不心酸，他把这件事在各界领导参加的协调会上提起，说自己当时已经知道孩子的父母已不在人世，却没法对不谙世事的孩子出口解释此事。,这一扯让黄镇东好心酸，他把这件事在各界领导参加的协调会上提起，说自己当时已经知道孩子的父母已不在人世，却没法对不谙世事的孩子出口解释此事。
1,差点没,”谢瑜噘着嘴道：“莫前辈，您不知道静室中面壁是什么滋味，以前我犯了错也被关过，才三天就差点没把我逼疯了，现在要我禁闭六十年之久，那不是要我的命了。,”谢瑜噘着嘴道：“莫前辈，您不知道静室中面壁是什么滋味，以前我犯了错也被关过，才三天就差点把我逼疯了，现在要我禁闭六十年之久，那不是要我的命了。
0,不要太a,有人劝他不要太死心眼，并说像他这样下去，一个朋友也落不下。,有人劝他太死心眼，并说像他这样下去，一个朋友也落不下。
1,难免不,我们再晚片刻，便难免不为所伤了。,我们再晚片刻，便难免为所伤了。
1,好不a,柳逐风离开后，柳追云昂藏的身影立刻闪出电梯旁的巨大盆栽，若有所思的眼眸直盯住柳晏飞办公室的大门，好半晌，他突然咧开了嘴，笑得好不诡异。赖你爱我第五章,柳逐风离开后，柳追云昂藏的身影立刻闪出电梯旁的巨大盆栽，若有所思的眼眸直盯住柳晏飞办公室的大门，好半晌，他突然咧开了嘴，笑得好诡异。赖你爱我第五章
1,差点没,”差一点没把狗子分了尸。,”差一点把狗子分了尸。
0,不要太a,“来歇歇，不要太努力，空气硬，海水硬！,“来歇歇，太努力，空气硬，海水硬！
1,好不a,"眼见意中人和别的女孩同撑一把伞子,有讲有笑的,好不温馨,而自己呢?个人撑著伞在人家的门口外呆站著.刹那间,整个人就像入定般,脸上毫无表情,心中只感到溜溜的,眼睛亦开始湿润了。","眼见意中人和别的女孩同撑一把伞子,有讲有笑的,好温馨,而自己呢?个人撑著伞在人家的门口外呆站著.刹那间,整个人就像入定般,脸上毫无表情,心中只感到溜溜的,眼睛亦开始湿润了。"
1,好不a,可在这时，她突然发现以前那些远不如自己的姐妹们早都阔了：比如“兰姐”，穿金戴银拿手，好不气派；还有“妹”，别看年龄小，也有了传呼机，据说不算穿衣，每月光吃喝消费就要花一二千元。,可在这时，她突然发现以前那些远不如自己的姐妹们早都阔了：比如“兰姐”，穿金戴银拿手，好气派；还有“妹”，别看年龄小，也有了传呼机，据说不算穿衣，每月光吃喝消费就要花一二千元。
0,不要太a,"_女人四十巧穿衣春雨<正>40多岁的女人已经有了些沧桑,岁月已将肉不客气地在肚子、手臂及臀部周围,但干万不要太悲观,巧妙穿衣会让自己亮丽起来。","_女人四十巧穿衣春雨<正>40多岁的女人已经有了些沧桑,岁月已将肉不客气地在肚子、手臂及臀部周围,但干万太悲观,巧妙穿衣会让自己亮丽起来。"
0,几乎没,"黄埔港口的退休工人张新如一辈子几乎没在剧场看过文艺演出,上周他去看了一场大型杂技晚会《金木水火土》。","黄埔港口的退休工人张新如一辈子几乎在剧场看过文艺演出,上周他去看了一场大型杂技晚会《金木水火土》。"
1,差点没,石蝶衣气嘟嘟地推开他的手，头顶气得差点没喷出白烟。,石蝶衣气嘟嘟地推开他的手，头顶气得差点喷出白烟。
1,几乎没,花有几朵，人就有多少个，几乎没挤死我们一家子人。,花有几朵，人就有多少个，几乎挤死我们一家子人。
1,险些没,我神情沮丧，险些没有哭出来。,我神情沮丧，险些有哭出来。
0,不要太a,聂王妃叹气说：＂风儿，你不要太冲动，我们要好好调查这姑娘的来处和意图。,聂王妃叹气说：＂风儿，你太冲动，我们要好好调查这姑娘的来处和意图。
1,好不a,新建的悦宾楼前，一溜十余个摊位前，人头攒动，好不热闹。挤到近前，方见各摊位上民间艺人各显其能，剪纸剪影，吹画指画，石壶石刻，龙凤书法，捏面人，棕编等等。,新建的悦宾楼前，一溜十余个摊位前，人头攒动，好热闹。挤到近前，方见各摊位上民间艺人各显其能，剪纸剪影，吹画指画，石壶石刻，龙凤书法，捏面人，棕编等等。
1,好不a,她的这一举动向我暗示了阿尔贝蒂娜再也不可能到来，我也不得不承认，确实是为了她，我才希望把自己修饰得漂亮潇洒一点，弗朗索瓦丝这一伸手，惹得我好不气恼，我一抽身，把花整个儿给弄皱了，加上她又对我说“最好还是让我取下来，免得这样碰坏了”，我更是火上加火。,她的这一举动向我暗示了阿尔贝蒂娜再也不可能到来，我也不得不承认，确实是为了她，我才希望把自己修饰得漂亮潇洒一点，弗朗索瓦丝这一伸手，惹得我好气恼，我一抽身，把花整个儿给弄皱了，加上她又对我说“最好还是让我取下来，免得这样碰坏了”，我更是火上加火。
1,好不a,我们社会就好像一幅毕加索先生的调颜料板，五光十色，好不可爱。洋大人见之，伸大拇指曰：「进步进步。,我们社会就好像一幅毕加索先生的调颜料板，五光十色，好可爱。洋大人见之，伸大拇指曰：「进步进步。
0,几乎没,全场几乎没有空座位，连楼梯也全部坐满，门口还站了很多同学，整个报告厅水泄不通。,全场几乎有空座位，连楼梯也全部坐满，门口还站了很多同学，整个报告厅水泄不通。
0,几乎没,"王皓出线几乎没遇到什么阻碍,只是在对阵朝鲜的正经哲的比赛中略见险情。","王皓出线几乎遇到什么阻碍,只是在对阵朝鲜的正经哲的比赛中略见险情。"
0,不要太a,当然，患者上医院期间不要太大意，特别是普通感冒去医院就诊最好戴上12层以上棉纱口罩或活性炭口罩，在三四个小时后就应换掉，回家之后则要立刻洗手。,当然，患者上医院期间太大意，特别是普通感冒去医院就诊最好戴上12层以上棉纱口罩或活性炭口罩，在三四个小时后就应换掉，回家之后则要立刻洗手。
0,不要太a,但我警告侄女不要太认真，因为这只能招来更头痛的事。,但我警告侄女太认真，因为这只能招来更头痛的事。
1,难免不,没有理由责怪消费者对出过假酒、毒酒的地方出产的酒抱有警惕，即使那个地方的名酒，也难免不受牵累。,没有理由责怪消费者对出过假酒、毒酒的地方出产的酒抱有警惕，即使那个地方的名酒，也难免受牵累。
0,不要太a,有一次他像是对自己也像是对我们说，不要太急了。,有一次他像是对自己也像是对我们说，太急了。
1,就差没,到第三年挂锄的时候，盖好三间小草房，[就差没]盘炕，没安门窗了,到第三年挂锄的时候，盖好三间小草房，[就差没]盘炕，没安门窗了
0,不要太a,你想着，我们相见不能太早，也不要太迟。,你想着，我们相见不能太早，也太迟。
0,几乎没,再后来，我认识了很多人，有了很多朋友，那次聚会在我脑海里几乎没留下什么痕迹。,再后来，我认识了很多人，有了很多朋友，那次聚会在我脑海里几乎留下什么痕迹。
1,好不a,到了半夜，他们走出房屋，看见木箱果然还在，也不问这里面有没有东西，抬了就走，只觉得这木箱好不沉重，等来到自己家里，就把箱子在他们两个老婆的房中随便一放，独自睡去了。,到了半夜，他们走出房屋，看见木箱果然还在，也不问这里面有没有东西，抬了就走，只觉得这木箱好沉重，等来到自己家里，就把箱子在他们两个老婆的房中随便一放，独自睡去了。
0,不要太a,”丽莉哭得倒在宁三怀里，宁三搂着她，轻轻地说：“丽莉姐，不要太难过，他会知道的！,”丽莉哭得倒在宁三怀里，宁三搂着她，轻轻地说：“丽莉姐，太难过，他会知道的！
0,不要太a,他坚信是金子自然会闪光的，况且他的自身条件不错，只要对方的身高不要太高挑就是了。,他坚信是金子自然会闪光的，况且他的自身条件不错，只要对方的身高太高挑就是了。
0,几乎没,您躺在床上，而她却几乎没穿什么，同时您的衣服在房里扔得到处都是。,您躺在床上，而她却几乎穿什么，同时您的衣服在房里扔得到处都是。
1,好不a,※※※洛阳城里，大街上行人熙来攘往，好不热闹。萧靖多年前曾到过此地几次，是以对城内的几条大街还算熟悉，没多久便来到了城东，找着了那间转运行。,※※※洛阳城里，大街上行人熙来攘往，好热闹。萧靖多年前曾到过此地几次，是以对城内的几条大街还算熟悉，没多久便来到了城东，找着了那间转运行。
1,好不a,”他抽抽搭搭地哭得好不凄惨。“大哥有了你，心里还想着别的女人，人家气不过嘛！,”他抽抽搭搭地哭得好凄惨。“大哥有了你，心里还想着别的女人，人家气不过嘛！
0,不要太a,“我说出来，你不要太吃惊。我的假设也并不见得对，但可以解释许多疑点。,“我说出来，你太吃惊。我的假设也并不见得对，但可以解释许多疑点。
1,好不a,他就这样回转家门，重又跟老婆团聚，掌管自己的财产，好不快乐，后来老婆的肚子一点点大起来了，他还认做他的功劳呢。,他就这样回转家门，重又跟老婆团聚，掌管自己的财产，好快乐，后来老婆的肚子一点点大起来了，他还认做他的功劳呢。
0,不要太a,”这是季平一贯的作风，胆大心细，桑雅一直都相信他，“不要太累了。,”这是季平一贯的作风，胆大心细，桑雅一直都相信他，“太累了。
0,几乎没,还记得有一次，家里吃猪肺，我吃得津津有味，可小胖却几乎没吃。她说猪肺脏，不卫生。,还记得有一次，家里吃猪肺，我吃得津津有味，可小胖却几乎吃。她说猪肺脏，不卫生。
0,a不死r,那可真是个天才呢，华生，可是，只要那些小爪牙弄不死我，我们就总有一天会得胜的。,那可真是个天才呢，华生，可是，只要那些小爪牙弄死我，我们就总有一天会得胜的。
1,难免不,日本在经济军事实力还说不上多么不得了的年代，竟一气搞了两场忘恩负义的战争，所以一听说“脱”呀“归”的，难免不教人有点疑神疑鬼。这样忽而装孙子，忽而当老子，除了思想文化如日本者，怕是任谁也做不来。,日本在经济军事实力还说不上多么不得了的年代，竟一气搞了两场忘恩负义的战争，所以一听说“脱”呀“归”的，难免教人有点疑神疑鬼。这样忽而装孙子，忽而当老子，除了思想文化如日本者，怕是任谁也做不来。
1,就差没,”男子像是小兵见到长官一样，立刻站得直直的，就差没举手敬礼了。,”男子像是小兵见到长官一样，立刻站得直直的，就差举手敬礼了。
1,好不a,白愁飞正值这当儿有许多大事要做的节骨眼上，却急尔想起孙鱼近日做了许多让他不满的事，而影响较大的事至少有这几件：他派孙鱼去暗杀朱小腰，孙鱼不但无功而返，而且从万里望的报告中显示，孙鱼还趁机与王小石叙旧，一声声什么“王三当家的”、“小鱼儿”的喊得好不亲热。孙鱼竟带领王小石从“深记洞窟”劫走了他手上的重要人质，王紫萍和王天六！,白愁飞正值这当儿有许多大事要做的节骨眼上，却急尔想起孙鱼近日做了许多让他不满的事，而影响较大的事至少有这几件：他派孙鱼去暗杀朱小腰，孙鱼不但无功而返，而且从万里望的报告中显示，孙鱼还趁机与王小石叙旧，一声声什么“王三当家的”、“小鱼儿”的喊得好亲热。孙鱼竟带领王小石从“深记洞窟”劫走了他手上的重要人质，王紫萍和王天六！
0,不要太a,所用茶叶量不宜太多，但也不要太少；冲泡的热水温厦以８０℃一ｇＯＴ为。,所用茶叶量不宜太多，但也太少；冲泡的热水温厦以８０℃一ｇＯＴ为。
0,几乎没,而秦海璐自己在中戏读书四年，几乎没拍过什么戏，整日就躲在宿舍里看书练功。,而秦海璐自己在中戏读书四年，几乎拍过什么戏，整日就躲在宿舍里看书练功。
1,好不a,你这个孩子，好不天真。”“欠下多少？,你这个孩子，好天真。”“欠下多少？
1,小心别,见面时，他交给珊妮一只封了口的鸡皮纸袋，嘱咐珊妮小心别掉了。,见面时，他交给珊妮一只封了口的鸡皮纸袋，嘱咐珊妮小心掉了。
0,不要太a,”承欢仍然笑，“责己不要太严。”辛家亮知道讲不过这个机伶女，只得握住她的手深深一吻。,”承欢仍然笑，“责己太严。”辛家亮知道讲不过这个机伶女，只得握住她的手深深一吻。
1,好不a,这一下子，成了。一切都完了，好不痛快！,这一下子，成了。一切都完了，好痛快！
0,好不a,行者努着嘴道：“好不知趣！这半山之中，前不巴村，后不着店，那讨香烛？,行者努着嘴道：“好知趣！这半山之中，前不巴村，后不着店，那讨香烛？
0,好不a,“他总是打达尼埃，看了好不舒服。”我对荷西说着。,“他总是打达尼埃，看了好舒服。”我对荷西说着。
0,好不a,生力，那新加盟又充满憧憬的新兵，感觉到自己的偶像竟在别人之下，心头好不自在。八万“铁甲兵”中，绝大部分是因为拜服小白的才智，而甘心服于麾下。,生力，那新加盟又充满憧憬的新兵，感觉到自己的偶像竟在别人之下，心头好自在。八万“铁甲兵”中，绝大部分是因为拜服小白的才智，而甘心服于麾下。
1,就差没,一碟花生米、一碟五香豆腐干、一碟小脆饼，就差没有一个酒壶和酒杯。,一碟花生米、一碟五香豆腐干、一碟小脆饼，就差有一个酒壶和酒杯。
1,差点没,他正在品尝人间酷似血色的蕃茄汁，差点没被正在打坐的小喜吓得给呛到。,他正在品尝人间酷似血色的蕃茄汁，差点被正在打坐的小喜吓得给呛到。
1,就差没,“只要能在嘴奶奶二十多岁死了丈夫，粗纸也舍不得多花一张的，省吃省用养大了这么个好儿子，一个月倒也挣得二三十块钱种家养眷，奶奶这份儿老福真也不差什么咧――就差没尝过洋饽饽儿的味儿！,“只要能在嘴奶奶二十多岁死了丈夫，粗纸也舍不得多花一张的，省吃省用养大了这么个好儿子，一个月倒也挣得二三十块钱种家养眷，奶奶这份儿老福真也不差什么咧――就差尝过洋饽饽儿的味儿！
1,差点没,”“本・刚恩，本・刚恩，”希尔弗喃喃地说，“你差一点没把我吓死！,”“本・刚恩，本・刚恩，”希尔弗喃喃地说，“你差一点把我吓死！
0,差点没,她由“情”字转回，碰到他的目光，差点没听见侍者的问话。,她由“情”字转回，碰到他的目光，差点听见侍者的问话。
0,不要太a,第三、在城市道路或高速公路上行，电喷车的车速不要太保守。一些车主出于安全考虑，在高速公路上最高时速也很少超过８０公里。,第三、在城市道路或高速公路上行，电喷车的车速太保守。一些车主出于安全考虑，在高速公路上最高时速也很少超过８０公里。
1,好不a,”翠芝抗议：“梁先生，你这话好不风凉，难为我为家务度日如年。,”翠芝抗议：“梁先生，你这话好风凉，难为我为家务度日如年。
1,差点没,开开门一看，老头儿蹦着就出来啦：“哎！驴回来啦！我说王铁嘴这卦灵嘛，一副药就回来啦。驴是回来啦，我差点没拉死！”过来摸摸这驴：“驴呀！驴呀！你哪儿去啦？你可把我想死了！要没王铁嘴这副药你回不来了。”,开开门一看，老头儿蹦着就出来啦：“哎！驴回来啦！我说王铁嘴这卦灵嘛，一副药就回来啦。驴是回来啦，我差点拉死！”过来摸摸这驴：“驴呀！驴呀！你哪儿去啦？你可把我想死了！要没王铁嘴这副药你回不来了。”
1,好不a,峨嵋“伏虎掌”名闻天下，他们一个个打得虎虎生风，好不凌厉！大师兄明通看到丁天仁从外走入，立即脸色一沉，喝道：“丁师弟，你一大清早，不练功，去了那里？,峨嵋“伏虎掌”名闻天下，他们一个个打得虎虎生风，好凌厉！大师兄明通看到丁天仁从外走入，立即脸色一沉，喝道：“丁师弟，你一大清早，不练功，去了那里？
0,几乎没,粘土捏的昆虫是我在中国见到的最精致的粘土制品，其中有金龟子、蚂蚱、大甲壳虫、螳螂、正在捕食的螳螂、蟾蜍和蝎子，另外一些则是在其他国家无法看到的，还有一些我们几乎没见过的泥虫子。,粘土捏的昆虫是我在中国见到的最精致的粘土制品，其中有金龟子、蚂蚱、大甲壳虫、螳螂、正在捕食的螳螂、蟾蜍和蝎子，另外一些则是在其他国家无法看到的，还有一些我们几乎见过的泥虫子。
0,不要太a,由于近期美元有转强的迹象，只要公布的数据不要太差，美元兑日元保持在120．00以上应当没有困难。,由于近期美元有转强的迹象，只要公布的数据太差，美元兑日元保持在120．00以上应当没有困难。
1,几乎没,做父亲的向后跌了开去，几乎没跌倒在地上，南仔又指着他的父亲，大声讲了几句话，就算在再惊骇的情形之下，也可以听到南仔的声音，可是那时，南仔讲的话，他的一家人，都全部听不懂！,做父亲的向后跌了开去，几乎跌倒在地上，南仔又指着他的父亲，大声讲了几句话，就算在再惊骇的情形之下，也可以听到南仔的声音，可是那时，南仔讲的话，他的一家人，都全部听不懂！
1,好不a,当他来到巨龙身边时，这食人魔已经是挺起了胸膛，昂首阔步好不得意。一根木棍潇洒地搭在他的肩上。他毫无生命之忧地站在巨大的躯体前，而且他很想上去揣一脚。不过卡尔提福特还是很满足地往巨龙的身上啐了一口。,当他来到巨龙身边时，这食人魔已经是挺起了胸膛，昂首阔步好得意。一根木棍潇洒地搭在他的肩上。他毫无生命之忧地站在巨大的躯体前，而且他很想上去揣一脚。不过卡尔提福特还是很满足地往巨龙的身上啐了一口。
0,几乎没,罗维民几乎没作任何停留，绕过处理现场的车辆和人群，向赶来现场的交警亮明身分，...,罗维民几乎作任何停留，绕过处理现场的车辆和人群，向赶来现场的交警亮明身分，...
1,差点没,这小高也太讨厌了，我差一点没哭出来。,这小高也太讨厌了，我差一点哭出来。
1,差点没,”说得这一对年轻人差一点没掉下眼泪来。,”说得这一对年轻人差一点掉下眼泪来。
1,差点没,突然，她被凑近的一张笑脸吓了一大跳，差点没惊叫出声。,突然，她被凑近的一张笑脸吓了一大跳，差点惊叫出声。
1,好不a,还有那掩在薄纱内，鲜艳欲滴的胴体，若隐若现的，好不诱人，两个男人都恨不得赶紧用布把她彻彻底底包裹起来，不要让对方看到。,还有那掩在薄纱内，鲜艳欲滴的胴体，若隐若现的，好诱人，两个男人都恨不得赶紧用布把她彻彻底底包裹起来，不要让对方看到。
0,好不a,“想到要在医院过夜，我就觉得好不自在哦！,“想到要在医院过夜，我就觉得好自在哦！
1,差点没,那位头发很光的小伙子差点儿没哭出来。,那位头发很光的小伙子差点儿哭出来。
0,几乎没,这里山大沟深，经济落后，文化生活贫乏，２０多年来，几乎没放过电影。,这里山大沟深，经济落后，文化生活贫乏，２０多年来，几乎放过电影。
1,差点没,”他假装镇定，内心差点没昏倒。,”他假装镇定，内心差点昏倒。
0,不要太a,”又对老孙说：“你也不要太生气，大家找你闹，而不去找华文贤闹，正说明了你在大家心里的分量。,”又对老孙说：“你也太生气，大家找你闹，而不去找华文贤闹，正说明了你在大家心里的分量。
1,差点没,”这句话差点没把百合给吓死，她不安的看着玫瑰，鹊乃担骸澳阋做什么？,”这句话差点把百合给吓死，她不安的看着玫瑰，鹊乃担骸澳阋做什么？
1,差点没,再看到永琪的人，老陈一吓之下差点没有屁滚尿流．他慌慌张张的放开怜情，然后一刻也不敢耽搁的逃走了！,再看到永琪的人，老陈一吓之下差点屁滚尿流．他慌慌张张的放开怜情，然后一刻也不敢耽搁的逃走了！
1,差点没,”站在门口的郭健听了这句话，差一点没笑出声来：这叫什么话呢？,”站在门口的郭健听了这句话，差一点笑出声来：这叫什么话呢？
1,好不a,好不嗦！应该让你陪同小鹤和彩蝶到江南去寻人，省得我耳膜受罪。,好嗦！应该让你陪同小鹤和彩蝶到江南去寻人，省得我耳膜受罪。
1,看我不,”熊大师兄，他若不姓沙还罢了，否则，我熊霸天找他单挑，看我不扭断他娘的脖子根！,”熊大师兄，他若不姓沙还罢了，否则，我熊霸天找他单挑，看我扭断他娘的脖子根！
